<?xml version="1.0"?>
<!DOCTYPE Report
[
<!ELEMENT Report (General ,(Doc|BPT)) >
<!ATTLIST Report ver CDATA #REQUIRED tmZone CDATA #REQUIRED>

<!ELEMENT General ( DocLocation ) >
<!ATTLIST General productName CDATA #REQUIRED productVer CDATA #REQUIRED os CDATA #REQUIRED host CDATA #REQUIRED>

<!ELEMENT BPT (DName,Res,DVer?,TSet?,TInst?,NodeArgs,AdditionalInfo*,Doc*) >
<!ATTLIST BPT rID ID #REQUIRED >

<!ELEMENT Doc (DName,Res,DVer?,TSet?,TInst?,RunType?,DT?,AdditionalInfo*,Step*,DIter*,Step*,Action*,Summary?,TestMaintenanceSummary*,NodeArgs?) >
<!ATTLIST Doc rID ID #REQUIRED type (Test|BC) "Test" productName CDATA #REQUIRED BCIter CDATA #IMPLIED >

<!ELEMENT RunType ( #PCDATA )>
<!ATTLIST RunType fmStep (False|True) "False" batch (False|True) "False" upDesc (False|True) "False" upChk (False|True) "False" upAS (False|True) "False">

<!ELEMENT DName ( #PCDATA ) >

<!ELEMENT Res ( #PCDATA ) >

<!ELEMENT AdditionalInfo (AdditionalDataName,AdditionalDataValue ) >

<!ELEMENT AdditionalDataName ( #PCDATA ) >

<!ELEMENT AdditionalDataValue ( #PCDATA ) >

<!ELEMENT DVer ( #PCDATA ) >

<!ELEMENT TSet ( #PCDATA ) >

<!ELEMENT TInst ( #PCDATA ) >

<!ELEMENT DIter (Step?,Action+,Summary?,NodeArgs)>
<!ATTLIST DIter rID ID #REQUIRED iterID CDATA #REQUIRED>

<!ELEMENT DocLocation ( #PCDATA )>

<!ELEMENT Action (AName,AIter*,(Step|HtmlStep|Action)*,Summary,ActionMaintenanceSummary*,NodeArgs ) >
<!ATTLIST Action rID ID #REQUIRED>

<!ELEMENT AIter ((Step|HtmlStep|Action)*,Summary?,NodeArgs) >
<!ATTLIST AIter rID ID #REQUIRED iterID CDATA #REQUIRED>

<!ELEMENT AName ( #PCDATA ) >

<!ELEMENT TestMaintenanceSummary (ActionMaintenanceSummary) >
<!ATTLIST TestMaintenanceSummary ObjectsAdded CDATA #REQUIRED ObjectsUpdated CDATA #REQUIRED StepsUpdated CDATA #REQUIRED StepsComments CDATA #REQUIRED><!ELEMENT ActionMaintenanceSummary (ObjectChange* ) >
<!ATTLIST ActionMaintenanceSummary Action CDATA #REQUIRED Objects CDATA #REQUIRED Updated CDATA #REQUIRED LinesTotal CDATA #REQUIRED Added CDATA #REQUIRED LinesUpdated CDATA #REQUIRED>

<!ELEMENT ObjectChange  (Hierarchy, PropertyChangeList* ) >
<!ATTLIST ObjectChange Operation CDATA #IMPLIED OriginalRepository CDATA #IMPLIED>

<!ELEMENT PropertyChangeList (PropertyDef) >

<!ELEMENT PropertyDef (OriginalValue, NewValue) >
<!ATTLIST PropertyDef PropName CDATA #REQUIRED OriginRegularExpression (True|False) "False" NewRegularExpression (True|False) "False" >

<!ELEMENT OriginalValue ( #PCDATA )>

<!ELEMENT NewValue ( #PCDATA )>

<!ELEMENT Hierarchy  (ObjectName, Hierarchy*) >
<!ATTLIST Hierarchy MicClass CDATA #REQUIRED>

<!ELEMENT ObjectName  ( #PCDATA ) >

<!ELEMENT Step (Obj,Details,Time,(Step|HtmlStep|Doc)*,NodeArgs) >
<!ATTLIST Step rID ID #REQUIRED retval CDATA #IMPLIED>

<!ELEMENT HtmlStep (HTML,(Step|HtmlStep|Doc)*,NodeArgs) >
<!ATTLIST HtmlStep rID ID #REQUIRED >

<!ELEMENT Obj ( #PCDATA ) >
<!ATTLIST Obj plainTxt (False|True) "True">

<!ELEMENT Details ( #PCDATA ) >
<!ATTLIST Details plainTxt (False|True) "True">

<!ELEMENT Time ( #PCDATA ) >

<!ELEMENT HTML ( #PCDATA ) >

<!ELEMENT Disp ( #PCDATA ) >

<!ELEMENT NodeArgs (Disp,TopPane?,BtmPane?)>
<!ATTLIST NodeArgs eType CDATA #REQUIRED icon CDATA #REQUIRED nRep CDATA #REQUIRED filter (False|True) "True">
<!ATTLIST NodeArgs status (Passed|Failed|Done|Warning|Information) "Done">
<!ATTLIST NodeArgs iconSel CDATA #IMPLIED nType CDATA #IMPLIED MovieMarker CDATA "">

<!ELEMENT TopPane (Path)>

<!ELEMENT BtmPane ( (Path|WR)?,ASHilite?)>
<!ATTLIST BtmPane vType CDATA "HTML">

<!ELEMENT Path ( #PCDATA ) >

<!ELEMENT ASHilite ( #PCDATA ) >

<!ELEMENT WR ( #PCDATA ) >

<!ELEMENT DT (NodeArgs) >
<!ATTLIST DT rID ID #REQUIRED>

<!ELEMENT Summary (Param*)>
<!ATTLIST Summary sTime CDATA #IMPLIED eTime CDATA #IMPLIED passed CDATA #IMPLIED failed CDATA #IMPLIED warnings CDATA #IMPLIED retval CDATA #IMPLIED stopped (False|True) "False" >

<!ELEMENT Param (ParamName,ParamVal)+ >
<!ATTLIST Param paramInOut (In|Out) "In">

<!ELEMENT ParamName ( #PCDATA ) >

<!ELEMENT ParamVal ( #PCDATA ) >

]
>
<Report ver="2.0" tmZone="India Standard Time">
<General productName="Vugen" productVer="12" os="" host="IND-MHP3DW70426"><DocLocation><![CDATA[D:\Load Runner\CoverAll\Create Appl_working]]></DocLocation></General>
<Doc rID="T1"   productName= "Vugen"  >
<DName><![CDATA[Create Appl_working]]></DName>
<Res><![CDATA[result1]]></Res>
<Action rID="T2">
<AName><![CDATA[vuser_init]]></AName>
<Summary sTime="5/2/2016 - 11:47:01" eTime="5/2/2016 - 11:47:02" passed="0" failed="0" warnings="0" ></Summary>
<NodeArgs eType="StartAction" icon="2" nRep="5" >
<Disp><![CDATA[vuser_init Summary]]></Disp>
</NodeArgs>
</Action>
<Action rID="T3">
<AName><![CDATA[Action]]></AName>
<AIter rID="T4" iterID="1" >
<Step rID="T5">
<Obj plainTxt="False" ><![CDATA[Navigate]]></Obj>
<Details plainTxt="False" ><![CDATA[1: Navigate to "https://agents.cover-all.com/" was finished]]></Details>
<Time><![CDATA[5/2/2016 - 11:47:29]]></Time>
<NodeArgs eType="General" icon="0" nRep="9" status="Passed" >
<Disp><![CDATA[Navigate]]></Disp>
</NodeArgs>
</Step>
<Step rID="T6">
<Obj plainTxt="False" ><![CDATA[Type]]></Obj>
<Details plainTxt="False" ><![CDATA[2.2: Type "admin" in Username textbox was finished]]></Details>
<Time><![CDATA[5/2/2016 - 11:47:31]]></Time>
<NodeArgs eType="General" icon="0" nRep="10" status="Passed" >
<Disp><![CDATA[Type]]></Disp>
</NodeArgs>
</Step>
<Step rID="T7">
<Obj plainTxt="False" ><![CDATA[Type]]></Obj>
<Details plainTxt="False" ><![CDATA[2.3: Type ********** in Password passwordbox was finished]]></Details>
<Time><![CDATA[5/2/2016 - 11:47:35]]></Time>
<NodeArgs eType="General" icon="0" nRep="11" status="Passed" >
<Disp><![CDATA[Type]]></Disp>
</NodeArgs>
</Step>
<Step rID="T8">
<Obj plainTxt="False" ><![CDATA[Click]]></Obj>
<Details plainTxt="False" ><![CDATA[2.4: Click on Log in button was finished]]></Details>
<Time><![CDATA[5/2/2016 - 11:47:54]]></Time>
<NodeArgs eType="General" icon="0" nRep="12" status="Passed" >
<Disp><![CDATA[Click]]></Disp>
</NodeArgs>
</Step>
<Step rID="T9">
<Obj plainTxt="False" ><![CDATA[Mouse Over]]></Obj>
<Details plainTxt="False" ><![CDATA[3.4: Move mouse over START button was finished]]></Details>
<Time><![CDATA[5/2/2016 - 11:47:58]]></Time>
<NodeArgs eType="General" icon="0" nRep="13" status="Passed" >
<Disp><![CDATA[Mouse Over]]></Disp>
</NodeArgs>
</Step>
<Step rID="T10">
<Obj plainTxt="False" ><![CDATA[Click]]></Obj>
<Details plainTxt="False" ><![CDATA[4: Click on button (1) button was finished]]></Details>
<Time><![CDATA[5/2/2016 - 11:47:59]]></Time>
<NodeArgs eType="General" icon="0" nRep="14" status="Passed" >
<Disp><![CDATA[Click]]></Disp>
</NodeArgs>
</Step>
<Step rID="T11">
<Obj plainTxt="False" ><![CDATA[Click]]></Obj>
<Details plainTxt="False" ><![CDATA[6: Click on Commercial Auto listitem was finished]]></Details>
<Time><![CDATA[5/2/2016 - 11:48:00]]></Time>
<NodeArgs eType="General" icon="0" nRep="15" status="Passed" >
<Disp><![CDATA[Click]]></Disp>
</NodeArgs>
</Step>
<Step rID="T12">
<Obj plainTxt="False" ><![CDATA[Click]]></Obj>
<Details plainTxt="False" ><![CDATA[8: Click on START button was finished]]></Details>
<Time><![CDATA[5/2/2016 - 11:48:01]]></Time>
<NodeArgs eType="General" icon="0" nRep="16" status="Passed" >
<Disp><![CDATA[Click]]></Disp>
</NodeArgs>
</Step>
<Step rID="T13">
<Obj plainTxt="False" ><![CDATA[Click]]></Obj>
<Details plainTxt="False" ><![CDATA[11: Click on Company textbox was finished]]></Details>
<Time><![CDATA[5/2/2016 - 11:48:08]]></Time>
<NodeArgs eType="General" icon="0" nRep="17" status="Passed" >
<Disp><![CDATA[Click]]></Disp>
</NodeArgs>
</Step>
<Step rID="T14">
<Obj plainTxt="False" ><![CDATA[Type]]></Obj>
<Details plainTxt="False" ><![CDATA[12: Type "Cover-all Company" in Company textbox was finished]]></Details>
<Time><![CDATA[5/2/2016 - 11:48:13]]></Time>
<NodeArgs eType="General" icon="0" nRep="18" status="Passed" >
<Disp><![CDATA[Type]]></Disp>
</NodeArgs>
</Step>
<Step rID="T15">
<Obj plainTxt="False" ><![CDATA[Type]]></Obj>
<Details plainTxt="False" ><![CDATA[13: Type "04/28/2016" in Effective Date textbox was finished]]></Details>
<Time><![CDATA[5/2/2016 - 11:48:17]]></Time>
<NodeArgs eType="General" icon="0" nRep="19" status="Passed" >
<Disp><![CDATA[Type]]></Disp>
</NodeArgs>
</Step>
<Step rID="T16">
<Obj plainTxt="False" ><![CDATA[Click]]></Obj>
<Details plainTxt="False" ><![CDATA[15: Click on Name textbox was finished]]></Details>
<Time><![CDATA[5/2/2016 - 11:48:18]]></Time>
<NodeArgs eType="General" icon="0" nRep="20" status="Passed" >
<Disp><![CDATA[Click]]></Disp>
</NodeArgs>
</Step>
<Step rID="T17">
<Obj plainTxt="False" ><![CDATA[Type]]></Obj>
<Details plainTxt="False" ><![CDATA[16: Type "Newbusiness1" in Name textbox was finished]]></Details>
<Time><![CDATA[5/2/2016 - 11:48:24]]></Time>
<NodeArgs eType="General" icon="0" nRep="21" status="Passed" >
<Disp><![CDATA[Type]]></Disp>
</NodeArgs>
</Step>
<Step rID="T18">
<Obj plainTxt="False" ><![CDATA[Click]]></Obj>
<Details plainTxt="False" ><![CDATA[18: Click on Street textbox was finished]]></Details>
<Time><![CDATA[5/2/2016 - 11:48:24]]></Time>
<NodeArgs eType="General" icon="0" nRep="22" status="Passed" >
<Disp><![CDATA[Click]]></Disp>
</NodeArgs>
</Step>
<Step rID="T19">
<Obj plainTxt="False" ><![CDATA[Type]]></Obj>
<Details plainTxt="False" ><![CDATA[19: Type "str555555" in Street textbox was finished]]></Details>
<Time><![CDATA[5/2/2016 - 11:48:28]]></Time>
<NodeArgs eType="General" icon="0" nRep="23" status="Passed" >
<Disp><![CDATA[Type]]></Disp>
</NodeArgs>
</Step>
<Step rID="T20">
<Obj plainTxt="False" ><![CDATA[Click]]></Obj>
<Details plainTxt="False" ><![CDATA[20: Click on textbox (2) textbox was finished]]></Details>
<Time><![CDATA[5/2/2016 - 11:48:29]]></Time>
<NodeArgs eType="General" icon="0" nRep="24" status="Passed" >
<Disp><![CDATA[Click]]></Disp>
</NodeArgs>
</Step>
<Step rID="T21">
<Obj plainTxt="False" ><![CDATA[Click]]></Obj>
<Details plainTxt="False" ><![CDATA[22: Click on Street textbox was finished]]></Details>
<Time><![CDATA[5/2/2016 - 11:48:29]]></Time>
<NodeArgs eType="General" icon="0" nRep="25" status="Passed" >
<Disp><![CDATA[Click]]></Disp>
</NodeArgs>
</Step>
<Step rID="T22">
<Obj plainTxt="False" ><![CDATA[Click]]></Obj>
<Details plainTxt="False" ><![CDATA[42: Click on NJAberdeen07747NJAbsecon... was finished]]></Details>
<Time><![CDATA[5/2/2016 - 11:48:30]]></Time>
<NodeArgs eType="General" icon="0" nRep="26" status="Passed" >
<Disp><![CDATA[Click]]></Disp>
</NodeArgs>
</Step>
<Step rID="T23">
<Obj plainTxt="False" ><![CDATA[Click]]></Obj>
<Details plainTxt="False" ><![CDATA[44: Click on button (2) button was finished]]></Details>
<Time><![CDATA[5/2/2016 - 11:48:32]]></Time>
<NodeArgs eType="General" icon="0" nRep="27" status="Passed" >
<Disp><![CDATA[Click]]></Disp>
</NodeArgs>
</Step>
<Step rID="T24">
<Obj plainTxt="False" ><![CDATA[Click]]></Obj>
<Details plainTxt="False" ><![CDATA[52: Click on Next button was finished]]></Details>
<Time><![CDATA[5/2/2016 - 11:48:39]]></Time>
<NodeArgs eType="General" icon="0" nRep="28" status="Passed" >
<Disp><![CDATA[Click]]></Disp>
</NodeArgs>
</Step>
<Step rID="T25">
<Obj plainTxt="False" ><![CDATA[Click]]></Obj>
<Details plainTxt="False" ><![CDATA[55: Click on Add button was finished]]></Details>
<Time><![CDATA[5/2/2016 - 11:48:46]]></Time>
<NodeArgs eType="General" icon="0" nRep="29" status="Passed" >
<Disp><![CDATA[Click]]></Disp>
</NodeArgs>
</Step>
<Step rID="T26">
<Obj plainTxt="False" ><![CDATA[Type]]></Obj>
<Details plainTxt="False" ><![CDATA[58: Type "0000000123" in Producer No. textbox was finished]]></Details>
<Time><![CDATA[5/2/2016 - 11:48:57]]></Time>
<NodeArgs eType="General" icon="0" nRep="30" status="Passed" >
<Disp><![CDATA[Type]]></Disp>
</NodeArgs>
</Step>
<Step rID="T27">
<Obj plainTxt="False" ><![CDATA[Click]]></Obj>
<Details plainTxt="False" ><![CDATA[60: Click on Producer No.0000000123Business... was finished]]></Details>
<Time><![CDATA[5/2/2016 - 11:48:57]]></Time>
<NodeArgs eType="General" icon="0" nRep="31" status="Passed" >
<Disp><![CDATA[Click]]></Disp>
</NodeArgs>
</Step>
<Step rID="T28">
<Obj plainTxt="False" ><![CDATA[Click]]></Obj>
<Details plainTxt="False" ><![CDATA[62: Click on Next button was finished]]></Details>
<Time><![CDATA[5/2/2016 - 11:48:58]]></Time>
<NodeArgs eType="General" icon="0" nRep="32" status="Passed" >
<Disp><![CDATA[Click]]></Disp>
</NodeArgs>
</Step>
<Step rID="T29">
<Obj plainTxt="False" ><![CDATA[Click]]></Obj>
<Details plainTxt="False" ><![CDATA[64: Click on DONE WITH Producers button was finished]]></Details>
<Time><![CDATA[5/2/2016 - 11:49:05]]></Time>
<NodeArgs eType="General" icon="0" nRep="33" status="Passed" >
<Disp><![CDATA[Click]]></Disp>
</NodeArgs>
</Step>
<Step rID="T30">
<Obj plainTxt="False" ><![CDATA[Click]]></Obj>
<Details plainTxt="False" ><![CDATA[66: Click on Producer No.0000000123Business... was finished]]></Details>
<Time><![CDATA[5/2/2016 - 11:49:05]]></Time>
<NodeArgs eType="General" icon="0" nRep="34" status="Passed" >
<Disp><![CDATA[Click]]></Disp>
</NodeArgs>
</Step>
<Step rID="T31">
<Obj plainTxt="False" ><![CDATA[Click]]></Obj>
<Details plainTxt="False" ><![CDATA[67: Click on Next button was finished]]></Details>
<Time><![CDATA[5/2/2016 - 11:49:08]]></Time>
<NodeArgs eType="General" icon="0" nRep="35" status="Passed" >
<Disp><![CDATA[Click]]></Disp>
</NodeArgs>
</Step>
<Step rID="T32">
<Obj plainTxt="False" ><![CDATA[Click]]></Obj>
<Details plainTxt="False" ><![CDATA[70: Click on Add button was finished]]></Details>
<Time><![CDATA[5/2/2016 - 11:49:15]]></Time>
<NodeArgs eType="General" icon="0" nRep="36" status="Passed" >
<Disp><![CDATA[Click]]></Disp>
</NodeArgs>
</Step>
<Step rID="T33">
<Obj plainTxt="False" ><![CDATA[Click]]></Obj>
<Details plainTxt="False" ><![CDATA[73: Click on State textbox was finished]]></Details>
<Time><![CDATA[5/2/2016 - 11:49:22]]></Time>
<NodeArgs eType="General" icon="0" nRep="37" status="Passed" >
<Disp><![CDATA[Click]]></Disp>
</NodeArgs>
</Step>
<Step rID="T34">
<Obj plainTxt="False" ><![CDATA[Click]]></Obj>
<Details plainTxt="False" ><![CDATA[74: Click on State textbox was finished]]></Details>
<Time><![CDATA[5/2/2016 - 11:49:23]]></Time>
<NodeArgs eType="General" icon="0" nRep="38" status="Passed" >
<Disp><![CDATA[Click]]></Disp>
</NodeArgs>
</Step>
<Step rID="T35">
<Obj plainTxt="False" ><![CDATA[Click]]></Obj>
<Details plainTxt="False" ><![CDATA[76: Click on State textbox was finished]]></Details>
<Time><![CDATA[5/2/2016 - 11:49:24]]></Time>
<NodeArgs eType="General" icon="0" nRep="39" status="Passed" >
<Disp><![CDATA[Click]]></Disp>
</NodeArgs>
</Step>
<Step rID="T36">
<Obj plainTxt="False" ><![CDATA[Click]]></Obj>
<Details plainTxt="False" ><![CDATA[80: Click on element (14) was finished]]></Details>
<Time><![CDATA[5/2/2016 - 11:49:24]]></Time>
<NodeArgs eType="General" icon="0" nRep="40" status="Passed" >
<Disp><![CDATA[Click]]></Disp>
</NodeArgs>
</Step>
<Step rID="T37">
<Obj plainTxt="False" ><![CDATA[Mouse Over]]></Obj>
<Details plainTxt="False" ><![CDATA[81.1: Move mouse over Arizona was finished]]></Details>
<Time><![CDATA[5/2/2016 - 11:49:26]]></Time>
<NodeArgs eType="General" icon="0" nRep="41" status="Passed" >
<Disp><![CDATA[Mouse Over]]></Disp>
</NodeArgs>
</Step>
<Step rID="T38">
<Obj plainTxt="False" ><![CDATA[Click]]></Obj>
<Details plainTxt="False" ><![CDATA[82: Click on Alabama button was finished]]></Details>
<Time><![CDATA[5/2/2016 - 11:49:27]]></Time>
<NodeArgs eType="General" icon="0" nRep="42" status="Passed" >
<Disp><![CDATA[Click]]></Disp>
</NodeArgs>
</Step>
<Step rID="T39">
<Obj plainTxt="False" ><![CDATA[Set]]></Obj>
<Details plainTxt="False" ><![CDATA[88: Check Liability checkbox was finished]]></Details>
<Time><![CDATA[5/2/2016 - 11:49:34]]></Time>
<NodeArgs eType="General" icon="0" nRep="43" status="Passed" >
<Disp><![CDATA[Set]]></Disp>
</NodeArgs>
</Step>
<Step rID="T40">
<Obj plainTxt="False" ><![CDATA[Click]]></Obj>
<Details plainTxt="False" ><![CDATA[90: Click on Combined Single Limit textbox was finished]]></Details>
<Time><![CDATA[5/2/2016 - 11:49:37]]></Time>
<NodeArgs eType="General" icon="0" nRep="44" status="Passed" >
<Disp><![CDATA[Click]]></Disp>
</NodeArgs>
</Step>
<Step rID="T41">
<Obj plainTxt="False" ><![CDATA[Type]]></Obj>
<Details plainTxt="False" ><![CDATA[91: Type "1000000" in Combined Single Limit textbox was finished]]></Details>
<Time><![CDATA[5/2/2016 - 11:49:40]]></Time>
<NodeArgs eType="General" icon="0" nRep="45" status="Passed" >
<Disp><![CDATA[Type]]></Disp>
</NodeArgs>
</Step>
<Step rID="T42">
<Obj plainTxt="False" ><![CDATA[Type]]></Obj>
<Details plainTxt="False" ><![CDATA[92: Type "1000" in Deductible textbox was finished]]></Details>
<Time><![CDATA[5/2/2016 - 11:49:41]]></Time>
<NodeArgs eType="General" icon="0" nRep="46" status="Passed" >
<Disp><![CDATA[Type]]></Disp>
</NodeArgs>
</Step>
<Step rID="T43">
<Obj plainTxt="False" ><![CDATA[Click]]></Obj>
<Details plainTxt="False" ><![CDATA[94: Click on Next button was finished]]></Details>
<Time><![CDATA[5/2/2016 - 11:49:42]]></Time>
<NodeArgs eType="General" icon="0" nRep="47" status="Passed" >
<Disp><![CDATA[Click]]></Disp>
</NodeArgs>
</Step>
<Step rID="T44">
<Obj plainTxt="False" ><![CDATA[Click]]></Obj>
<Details plainTxt="False" ><![CDATA[97: Click on DONE WITH State Coverage... button was finished]]></Details>
<Time><![CDATA[5/2/2016 - 11:49:49]]></Time>
<NodeArgs eType="General" icon="0" nRep="48" status="Passed" >
<Disp><![CDATA[Click]]></Disp>
</NodeArgs>
</Step>
<Step rID="T45">
<Obj plainTxt="False" ><![CDATA[Click]]></Obj>
<Details plainTxt="False" ><![CDATA[100: Click on Next button was finished]]></Details>
<Time><![CDATA[5/2/2016 - 11:49:56]]></Time>
<NodeArgs eType="General" icon="0" nRep="49" status="Passed" >
<Disp><![CDATA[Click]]></Disp>
</NodeArgs>
</Step>
<Step rID="T46">
<Obj plainTxt="False" ><![CDATA[Click]]></Obj>
<Details plainTxt="False" ><![CDATA[103: Click on Add button was finished]]></Details>
<Time><![CDATA[5/2/2016 - 11:50:03]]></Time>
<NodeArgs eType="General" icon="0" nRep="50" status="Passed" >
<Disp><![CDATA[Click]]></Disp>
</NodeArgs>
</Step>
<Step rID="T47">
<Obj plainTxt="False" ><![CDATA[Set]]></Obj>
<Details plainTxt="False" ><![CDATA[106: Check Main Location checkbox was finished]]></Details>
<Time><![CDATA[5/2/2016 - 11:50:10]]></Time>
<NodeArgs eType="General" icon="0" nRep="51" status="Passed" >
<Disp><![CDATA[Set]]></Disp>
</NodeArgs>
</Step>
<Step rID="T48">
<Obj plainTxt="False" ><![CDATA[Click]]></Obj>
<Details plainTxt="False" ><![CDATA[107: Click on Street textbox was finished]]></Details>
<Time><![CDATA[5/2/2016 - 11:50:11]]></Time>
<NodeArgs eType="General" icon="0" nRep="52" status="Passed" >
<Disp><![CDATA[Click]]></Disp>
</NodeArgs>
</Step>
<Step rID="T49">
<Obj plainTxt="False" ><![CDATA[Type]]></Obj>
<Details plainTxt="False" ><![CDATA[108: Type "str88676" in Street textbox was finished]]></Details>
<Time><![CDATA[5/2/2016 - 11:50:14]]></Time>
<NodeArgs eType="General" icon="0" nRep="53" status="Passed" >
<Disp><![CDATA[Type]]></Disp>
</NodeArgs>
</Step>
<Step rID="T50">
<Obj plainTxt="False" ><![CDATA[Click]]></Obj>
<Details plainTxt="False" ><![CDATA[109: Click on Producer No.0000000123Business... was finished]]></Details>
<Time><![CDATA[5/2/2016 - 11:50:14]]></Time>
<NodeArgs eType="General" icon="0" nRep="54" status="Passed" >
<Disp><![CDATA[Click]]></Disp>
</NodeArgs>
</Step>
<Step rID="T51">
<Obj plainTxt="False" ><![CDATA[Click]]></Obj>
<Details plainTxt="False" ><![CDATA[110: Click on Zip textbox was finished]]></Details>
<Time><![CDATA[5/2/2016 - 11:50:15]]></Time>
<NodeArgs eType="General" icon="0" nRep="55" status="Passed" >
<Disp><![CDATA[Click]]></Disp>
</NodeArgs>
</Step>
<Step rID="T52">
<Obj plainTxt="False" ><![CDATA[Type]]></Obj>
<Details plainTxt="False" ><![CDATA[111: Type "08201" in Zip textbox was finished]]></Details>
<Time><![CDATA[5/2/2016 - 11:50:18]]></Time>
<NodeArgs eType="General" icon="0" nRep="56" status="Passed" >
<Disp><![CDATA[Type]]></Disp>
</NodeArgs>
</Step>
<Step rID="T53">
<Obj plainTxt="False" ><![CDATA[Click]]></Obj>
<Details plainTxt="False" ><![CDATA[113: Click on Next button was finished]]></Details>
<Time><![CDATA[5/2/2016 - 11:50:18]]></Time>
<NodeArgs eType="General" icon="0" nRep="57" status="Passed" >
<Disp><![CDATA[Click]]></Disp>
</NodeArgs>
</Step>
<Step rID="T54">
<Obj plainTxt="False" ><![CDATA[Click]]></Obj>
<Details plainTxt="False" ><![CDATA[115: Click on DONE WITH Locations button was finished]]></Details>
<Time><![CDATA[5/2/2016 - 11:50:25]]></Time>
<NodeArgs eType="General" icon="0" nRep="58" status="Passed" >
<Disp><![CDATA[Click]]></Disp>
</NodeArgs>
</Step>
<Step rID="T55">
<Obj plainTxt="False" ><![CDATA[Click]]></Obj>
<Details plainTxt="False" ><![CDATA[118: Click on Add button was finished]]></Details>
<Time><![CDATA[5/2/2016 - 11:50:32]]></Time>
<NodeArgs eType="General" icon="0" nRep="59" status="Passed" >
<Disp><![CDATA[Click]]></Disp>
</NodeArgs>
</Step>
<Step rID="T56">
<Obj plainTxt="False" ><![CDATA[Type]]></Obj>
<Details plainTxt="False" ><![CDATA[122: Type "MR." in Title Prefix textbox was finished]]></Details>
<Time><![CDATA[5/2/2016 - 11:50:40]]></Time>
<NodeArgs eType="General" icon="0" nRep="60" status="Passed" >
<Disp><![CDATA[Type]]></Disp>
</NodeArgs>
</Step>
<Step rID="T57">
<Obj plainTxt="False" ><![CDATA[Type]]></Obj>
<Details plainTxt="False" ><![CDATA[124: Type "THOMAS" in First Name textbox was finished]]></Details>
<Time><![CDATA[5/2/2016 - 11:50:49]]></Time>
<NodeArgs eType="General" icon="0" nRep="61" status="Passed" >
<Disp><![CDATA[Type]]></Disp>
</NodeArgs>
</Step>
<Step rID="T58">
<Obj plainTxt="False" ><![CDATA[Type]]></Obj>
<Details plainTxt="False" ><![CDATA[126.1: Type "" in Middle Name textbox was finished]]></Details>
<Time><![CDATA[5/2/2016 - 11:50:56]]></Time>
<NodeArgs eType="General" icon="0" nRep="62" status="Passed" >
<Disp><![CDATA[Type]]></Disp>
</NodeArgs>
</Step>
<Step rID="T59">
<Obj plainTxt="False" ><![CDATA[Click]]></Obj>
<Details plainTxt="False" ><![CDATA[128: Click on Last Name textbox was finished]]></Details>
<Time><![CDATA[5/2/2016 - 11:50:57]]></Time>
<NodeArgs eType="General" icon="0" nRep="63" status="Passed" >
<Disp><![CDATA[Click]]></Disp>
</NodeArgs>
</Step>
<Step rID="T60">
<Obj plainTxt="False" ><![CDATA[Type]]></Obj>
<Details plainTxt="False" ><![CDATA[129: Type "LEE" in Last Name textbox was finished]]></Details>
<Time><![CDATA[5/2/2016 - 11:50:59]]></Time>
<NodeArgs eType="General" icon="0" nRep="64" status="Passed" >
<Disp><![CDATA[Type]]></Disp>
</NodeArgs>
</Step>
<Step rID="T61">
<Obj plainTxt="False" ><![CDATA[Type]]></Obj>
<Details plainTxt="False" ><![CDATA[130: Type "" in Name Suffix textbox was finished]]></Details>
<Time><![CDATA[5/2/2016 - 11:51:00]]></Time>
<NodeArgs eType="General" icon="0" nRep="65" status="Passed" >
<Disp><![CDATA[Type]]></Disp>
</NodeArgs>
</Step>
<Step rID="T62">
<Obj plainTxt="False" ><![CDATA[Type]]></Obj>
<Details plainTxt="False" ><![CDATA[131: Type "10/10/1982" in Date of Birth textbox was finished]]></Details>
<Time><![CDATA[5/2/2016 - 11:51:04]]></Time>
<NodeArgs eType="General" icon="0" nRep="66" status="Passed" >
<Disp><![CDATA[Type]]></Disp>
</NodeArgs>
</Step>
<Step rID="T63">
<Obj plainTxt="False" ><![CDATA[Click]]></Obj>
<Details plainTxt="False" ><![CDATA[133: Click on on was finished]]></Details>
<Time><![CDATA[5/2/2016 - 11:51:05]]></Time>
<NodeArgs eType="General" icon="0" nRep="67" status="Passed" >
<Disp><![CDATA[Click]]></Disp>
</NodeArgs>
</Step>
<Step rID="T64">
<Obj plainTxt="False" ><![CDATA[Click]]></Obj>
<Details plainTxt="False" ><![CDATA[135: Click on Next button was finished]]></Details>
<Time><![CDATA[5/2/2016 - 11:51:06]]></Time>
<NodeArgs eType="General" icon="0" nRep="68" status="Passed" >
<Disp><![CDATA[Click]]></Disp>
</NodeArgs>
</Step>
<Step rID="T65">
<Obj plainTxt="False" ><![CDATA[Click]]></Obj>
<Details plainTxt="False" ><![CDATA[137: Click on DONE WITH Drivers button was finished]]></Details>
<Time><![CDATA[5/2/2016 - 11:51:12]]></Time>
<NodeArgs eType="General" icon="0" nRep="69" status="Passed" >
<Disp><![CDATA[Click]]></Disp>
</NodeArgs>
</Step>
<Step rID="T66">
<Obj plainTxt="False" ><![CDATA[Click]]></Obj>
<Details plainTxt="False" ><![CDATA[140: Click on Add button was finished]]></Details>
<Time><![CDATA[5/2/2016 - 11:51:19]]></Time>
<NodeArgs eType="General" icon="0" nRep="70" status="Passed" >
<Disp><![CDATA[Click]]></Disp>
</NodeArgs>
</Step>
<Step rID="T67">
<Obj plainTxt="False" ><![CDATA[Click]]></Obj>
<Details plainTxt="False" ><![CDATA[143: Click on Year textbox was finished]]></Details>
<Time><![CDATA[5/2/2016 - 11:51:27]]></Time>
<NodeArgs eType="General" icon="0" nRep="71" status="Passed" >
<Disp><![CDATA[Click]]></Disp>
</NodeArgs>
</Step>
<Step rID="T68">
<Obj plainTxt="False" ><![CDATA[Type]]></Obj>
<Details plainTxt="False" ><![CDATA[144: Type "2000" in Year textbox was finished]]></Details>
<Time><![CDATA[5/2/2016 - 11:51:29]]></Time>
<NodeArgs eType="General" icon="0" nRep="72" status="Passed" >
<Disp><![CDATA[Type]]></Disp>
</NodeArgs>
</Step>
<Step rID="T69">
<Obj plainTxt="False" ><![CDATA[Click]]></Obj>
<Details plainTxt="False" ><![CDATA[146: Click on Make textbox was finished]]></Details>
<Time><![CDATA[5/2/2016 - 11:51:30]]></Time>
<NodeArgs eType="General" icon="0" nRep="73" status="Passed" >
<Disp><![CDATA[Click]]></Disp>
</NodeArgs>
</Step>
<Step rID="T70">
<Obj plainTxt="False" ><![CDATA[Type]]></Obj>
<Details plainTxt="False" ><![CDATA[147: Type "ACURA" in Make textbox was finished]]></Details>
<Time><![CDATA[5/2/2016 - 11:51:33]]></Time>
<NodeArgs eType="General" icon="0" nRep="74" status="Passed" >
<Disp><![CDATA[Type]]></Disp>
</NodeArgs>
</Step>
<Step rID="T71">
<Obj plainTxt="False" ><![CDATA[Type]]></Obj>
<Details plainTxt="False" ><![CDATA[148: Type "MDX" in Model textbox was finished]]></Details>
<Time><![CDATA[5/2/2016 - 11:51:34]]></Time>
<NodeArgs eType="General" icon="0" nRep="75" status="Passed" >
<Disp><![CDATA[Type]]></Disp>
</NodeArgs>
</Step>
<Step rID="T72">
<Obj plainTxt="False" ><![CDATA[Type]]></Obj>
<Details plainTxt="False" ><![CDATA[150: Type "Str3333" in Street textbox was finished]]></Details>
<Time><![CDATA[5/2/2016 - 11:51:36]]></Time>
<NodeArgs eType="General" icon="0" nRep="76" status="Passed" >
<Disp><![CDATA[Type]]></Disp>
</NodeArgs>
</Step>
<Step rID="T73">
<Obj plainTxt="False" ><![CDATA[Click]]></Obj>
<Details plainTxt="False" ><![CDATA[152: Click on Zip textbox was finished]]></Details>
<Time><![CDATA[5/2/2016 - 11:51:37]]></Time>
<NodeArgs eType="General" icon="0" nRep="77" status="Passed" >
<Disp><![CDATA[Click]]></Disp>
</NodeArgs>
</Step>
<Step rID="T74">
<Obj plainTxt="False" ><![CDATA[Type]]></Obj>
<Details plainTxt="False" ><![CDATA[154: Type "67510" in Zip textbox was finished]]></Details>
<Time><![CDATA[5/2/2016 - 11:51:40]]></Time>
<NodeArgs eType="General" icon="0" nRep="78" status="Passed" >
<Disp><![CDATA[Type]]></Disp>
</NodeArgs>
</Step>
<Step rID="T75">
<Obj plainTxt="False" ><![CDATA[Click]]></Obj>
<Details plainTxt="False" ><![CDATA[156: Click on Size textbox was finished]]></Details>
<Time><![CDATA[5/2/2016 - 11:51:41]]></Time>
<NodeArgs eType="General" icon="0" nRep="79" status="Passed" >
<Disp><![CDATA[Click]]></Disp>
</NodeArgs>
</Step>
<Step rID="T76">
<Obj plainTxt="False" ><![CDATA[Type]]></Obj>
<Details plainTxt="False" ><![CDATA[157: Type "Extra-Heavy Truck-Tractors" in Size textbox was finished]]></Details>
<Time><![CDATA[5/2/2016 - 11:51:51]]></Time>
<NodeArgs eType="General" icon="0" nRep="80" status="Passed" >
<Disp><![CDATA[Type]]></Disp>
</NodeArgs>
</Step>
<Step rID="T77">
<Obj plainTxt="False" ><![CDATA[Click]]></Obj>
<Details plainTxt="False" ><![CDATA[159: Click on Radius textbox was finished]]></Details>
<Time><![CDATA[5/2/2016 - 11:51:52]]></Time>
<NodeArgs eType="General" icon="0" nRep="81" status="Passed" >
<Disp><![CDATA[Click]]></Disp>
</NodeArgs>
</Step>
<Step rID="T78">
<Obj plainTxt="False" ><![CDATA[Type]]></Obj>
<Details plainTxt="False" ><![CDATA[160: Type "Intermediate(51 To 200 Miles)" in Radius textbox was finished]]></Details>
<Time><![CDATA[5/2/2016 - 11:52:02]]></Time>
<NodeArgs eType="General" icon="0" nRep="82" status="Passed" >
<Disp><![CDATA[Type]]></Disp>
</NodeArgs>
</Step>
<Step rID="T79">
<Obj plainTxt="False" ><![CDATA[Click]]></Obj>
<Details plainTxt="False" ><![CDATA[161: Click on Radius textbox was finished]]></Details>
<Time><![CDATA[5/2/2016 - 11:52:03]]></Time>
<NodeArgs eType="General" icon="0" nRep="83" status="Passed" >
<Disp><![CDATA[Click]]></Disp>
</NodeArgs>
</Step>
<Step rID="T80">
<Obj plainTxt="False" ><![CDATA[Click]]></Obj>
<Details plainTxt="False" ><![CDATA[163: Click on Special Industry Type textbox was finished]]></Details>
<Time><![CDATA[5/2/2016 - 11:52:04]]></Time>
<NodeArgs eType="General" icon="0" nRep="84" status="Passed" >
<Disp><![CDATA[Click]]></Disp>
</NodeArgs>
</Step>
<Step rID="T81">
<Obj plainTxt="False" ><![CDATA[Type]]></Obj>
<Details plainTxt="False" ><![CDATA[164: Type "Contractors" in Special Industry Type textbox was finished]]></Details>
<Time><![CDATA[5/2/2016 - 11:52:07]]></Time>
<NodeArgs eType="General" icon="0" nRep="85" status="Passed" >
<Disp><![CDATA[Type]]></Disp>
</NodeArgs>
</Step>
<Step rID="T82">
<Obj plainTxt="False" ><![CDATA[Click]]></Obj>
<Details plainTxt="False" ><![CDATA[166: Click on Special Industry Class textbox was finished]]></Details>
<Time><![CDATA[5/2/2016 - 11:52:08]]></Time>
<NodeArgs eType="General" icon="0" nRep="86" status="Passed" >
<Disp><![CDATA[Click]]></Disp>
</NodeArgs>
</Step>
<Step rID="T83">
<Obj plainTxt="False" ><![CDATA[Type]]></Obj>
<Details plainTxt="False" ><![CDATA[167: Type "All Other" in Special Industry Class textbox was finished]]></Details>
<Time><![CDATA[5/2/2016 - 11:52:12]]></Time>
<NodeArgs eType="General" icon="0" nRep="87" status="Passed" >
<Disp><![CDATA[Type]]></Disp>
</NodeArgs>
</Step>
<Step rID="T84">